"Item type","Authors","Title","Journal","Publication year","Volume","Issue","Pages","Publisher","Address","Date published","ISSN","URLs","DOI","Abstract","Keywords","Notes"
"Journal Article","Fadlallah H,Kilany R,Dhayne H,El Haddad R,Haque R,Taher Y,Jaber A","Context-aware Big Data Quality Assessment: A Scoping Review","J. Data and Information Quality","2023","15","3","","Association for Computing Machinery","New York, NY, USA","2023-08","1936-1955","https://doi.org/10.1145/3603707;http://dx.doi.org/10.1145/3603707","10.1145/3603707","The term data quality refers to measuring the fitness of data regarding the intended usage. Poor data quality leads to inadequate, inconsistent, and erroneous decisions that could escalate the computational cost, cause a decline in profits, and cause customer churn. Thus, data quality is crucial for researchers and industry practitioners.Different factors drive the assessment of data quality. Data context is deemed one of the key factors due to the contextual diversity of real-world use cases of various entities such as people and organizations. Data used in a specific context (e.g., an organization policy) may need to be more efficacious for another context. Hence, implementing a data quality assessment solution in different contexts is challenging.Traditional technologies for data quality assessment reached the pinnacle of maturity. Existing solutions can solve most of the quality issues. The data context in these solutions is defined as validation rules applied within the ETL (extract, transform, load) process, i.e., the data warehousing process. In contrast to traditional data quality management, it is impossible to specify all the data semantics beforehand for big data. We need context-aware data quality rules to detect semantic errors in a massive amount of heterogeneous data generated at high speed. While many researchers tackle the quality issues of big data, they define the data context from a specific standpoint. Although data quality is a longstanding research issue in academia and industries, it remains an open issue, especially with the advent of big data, which has fostered the challenge of data quality assessment more than ever.This article provides a scoping review to study the existing context-aware data quality assessment solutions, starting with the existing big data quality solutions in general and then covering context-aware solutions. The strength and weaknesses of such solutions are outlined and discussed. The survey showed that none of the existing data quality assessment solutions could guarantee context awareness with the ability to handle big data. Notably, each solution dealt only with a partial view of the context. We compared the existing quality models and solutions to reach a comprehensive view covering the aspects of context awareness when assessing data quality. This led us to a set of recommendations framed in a methodological framework shaping the design and implementation of any context-aware data quality service for big data. Open challenges are then identified and discussed.","data quality assessment, context awareness, big data, Data quality",""
"Journal Article","Meurisch C,Mühlhäuser M","Data Protection in AI Services: A Survey","ACM Comput. Surv.","2021","54","2","","Association for Computing Machinery","New York, NY, USA","2021-03","0360-0300","https://doi.org/10.1145/3440754;http://dx.doi.org/10.1145/3440754","10.1145/3440754","Advances in artificial intelligence (AI) have shaped today’s user services, enabling enhanced personalization and better support. As such AI-based services inevitably require user data, the resulting privacy implications are de facto the unacceptable face of this technology. In this article, we categorize and survey the cutting-edge research on privacy and data protection in the context of personalized AI services. We further review the different protection approaches at three different levels, namely, the management, system, and AI levels—showing that (i) not all of them meet our identified requirements of evolving AI services and that (ii) many challenges are addressed separately or fragmentarily by different research communities. Finally, we highlight open research challenges and future directions in data protection research, especially that comprehensive protection requires more interdisciplinary research and a combination of approaches at different levels.","privacy, personalization, data protection, data decentralization, AI services",""
"Journal Article","Bopp C,Voida A","""Showing the Context"": A Need for Oligopticonic Information Systems in Homelessness Measurement","Proc.  ACM Hum. -Comput.  Interact.","2023","7","CSCW1","","Association for Computing Machinery","New York, NY, USA","2023-04","","https://doi.org/10.1145/3579622;http://dx.doi.org/10.1145/3579622","10.1145/3579622","Organizations like businesses, governments, and nonprofits often have established milestones to stay focused on their strategic goals. However, public and social sector organizations often have goals that are difficult to measure. To better understand how data can be more sensitively appropriated in difficult-to-measure contexts, we conducted design workshops with 25 individuals with a stake in how homelessness is measured - including funders, staff and people experiencing homelessness. This study provides a detailed account of how diverse stakeholders measure progress towards these often difficult and vague goals. We found that the approaches to data collection fall under either the sociocentric perspective (which seeks to answer questions about community-level impact) or the egocentric perspective (which focuses more on the experience of the individual experiencing homelessness). We argue that in contexts where goals are vague and difficult to observe or measure, collaborative information systems should be approached by combining the sociocentric and egocentric perspectives into an oligopticon, rather than focusing only on the sociocentric perspective (which can be understood as a panopticon). As we outline, oligopticonic information systems have the capacity to deal with more diverse types of data and experiences by embracing the requirements that we have outlined.","context, data, decision making, design workshops, egocentric, homelessness, impact evaluation, oligopticon, outcome measurement, panopticon, sociocentric",""
"Journal Article","Jamieson J,Yamashita N","Escaping the Walled Garden? User Perspectives of Control in Data Portability for Social Media","Proc.  ACM Hum. -Comput.  Interact.","2023","7","CSCW2","","Association for Computing Machinery","New York, NY, USA","2023-10","","https://doi.org/10.1145/3610188;http://dx.doi.org/10.1145/3610188","10.1145/3610188","Data portability--the capability to transfer one's data from one platform to another--has been described as an important tool for giving individuals more control over their data. It is defined in significant regulations such as the GDPR, and implemented by major online platforms. Unfortunately, there is a lack of research investigating internet users' perceptions and expectations of this technology in specific contexts, which is vital for building effective designs. One particularly important context for studying user perspectives is social media, since it is deeply embedded into daily life and is particularly complex regarding the value and portability of user data. This paper addresses that gap through a survey and interviews of social media users in the United States. We identify current attitudes and practices toward controlling their social media data, and examine participants' impressions about the extent to which data portability may enhance their control. Participants had generally favorable impressions, but had differing opinions about what forms of control are important and the extent to which those could be served by data portability. Based on the results, we propose future directions for improving users' control in the context of social media, such as fine-tuned filtering of data to be transferred and ways to coordinate transfers alongside social contacts.","CCPA, GDPR, data protection, digital rights, personal data, privacy, social media data, social networking sites, user control, user empowerment",""
"Journal Article","Zendle D,Flick C,Deterding S,Cutting J,Gordon-Petrovskaya E,Drachen A","The Many Faces of Monetisation: Understanding the Diversity and Extremity of Player Spending in Mobile Games via Massive-scale Transactional Analysis","ACM Games","2023","1","1","","Association for Computing Machinery","New York, NY, USA","2023-03","","https://doi.org/10.1145/3582927;http://dx.doi.org/10.1145/3582927","10.1145/3582927","With the rise of microtransactions, particularly in the mobile games industry, there has been ongoing concern that games reliant on these obtain substantial revenue from a small proportion of heavily involved individuals, to an extent that may be financially burdensome to these individuals. Yet despite substantive grey literature and speculation on this topic, there is little robust data available. We explore the revenue distribution in microtransaction-based mobile games using a transactional dataset of $4.7B in in-game spending drawn from 69,144,363 players of 2,873 mobile games over the course of 624 days. We find diverse revenue distributions in mobile games, ranging from a “uniform” cluster, in which all spenders invest approximately similar amounts, to “hyper-Pareto” games, in which a large proportion of revenue (approximately 38\%) stems from 1\% of spenders alone. Specific kinds of games are typified by higher spending: The more a game relies on its top 1\% for revenue generation, the more these individuals tend to spend, with simulated gambling products (“social casinos”) at the top. We find a small subset of games across all genres, clusters, and age ratings in which the top 1\% of gamers are highly financially involved—spending an average of $66,285 each in the 624 days under evaluation in the most extreme case. We discuss implications for future studies on links between gaming and wellbeing.","mobile gaming, mobile games, video games, monetisation, In-app spending",""
"Journal Article","Anjos JC,Matteussi KJ,Orlandi FC,Barbosa JL,Silva JS,Bittencourt LF,Geyer CF","A Survey on Collaborative Learning for Intelligent Autonomous Systems","ACM Comput. Surv.","2023","56","4","","Association for Computing Machinery","New York, NY, USA","2023-11","0360-0300","https://doi.org/10.1145/3625544;http://dx.doi.org/10.1145/3625544","10.1145/3625544","This survey examines approaches to promote Collaborative Learning in distributed systems for emergent Intelligent Autonomous Systems (IAS). The study involves a literature review of Intelligent Autonomous Systems based on Collaborative Learning, analyzing aspects in four dimensions: computing environment, performance concerns, system management, and privacy concerns, mapping the significant requirements of systems to the emerging Artificial intelligence models. Furthermore, the article explores Collaborative Learning Taxonomy for IAS to demonstrate the correlation between IoT, Big Data, and Human-in-the-Loop. Several technological open issues exist in the aforementioned domains (such as in applications of autonomous driving, robotics in healthcare, cyber security, and others) to effectively achieve the future deployment of Intelligent Autonomous Systems. This Survey aims to organize concepts around IAS, indicating the approaches used to extract knowledge from data in Collaborative Learning for IAS, and identifying open issues. Moreover, it presents a guide to overcoming the existing challenges in decision-making mechanisms with IAS, providing a holistic vision of Big Data and Human-in-the-Loop.","distributed systems, autonomous systems, big data, Collaborative learning",""
"Journal Article","Li Y,Lu J,Chandramouli B","Selection Pushdown in Column Stores using Bit Manipulation Instructions","Proc. ACM Manag. Data","2023","1","2","","Association for Computing Machinery","New York, NY, USA","2023-06","","https://doi.org/10.1145/3589323;http://dx.doi.org/10.1145/3589323","10.1145/3589323","Modern analytical database systems predominantly rely on column-oriented storage, which offers superior compression efficiency due to the nature of the columnar layout. This compression, however, creates challenges in decoding speed during query processing. Previous research has explored predicate pushdown on encoded values to avoid decoding, but these techniques are restricted to specific encoding schemes and predicates, limiting their practical use. In this paper, we propose a generic predicate pushdown approach that supports arbitrary predicates by leveraging selection pushdown to reduce decoding costs. At the core of our approach is a fast select operator capable of directly extracting selected encoded values without decoding, by using Bit Manipulation Instructions, an instruction set extension to the X86 architecture. We empirically evaluate the proposed techniques in the context of Apache Parquet using both micro-benchmarks and the TPC-H benchmark, and show that our techniques improve the query performance of Parquet by up to one order of magnitude with representative scan queries. Further experimentation using Apache Spark demonstrates speed improvements of up to 5.5X even for end-to-end queries involving complex joins.","BMI, column stores, compression, predicate pushdown",""
"Journal Article","Yang Q","Toward Responsible AI: An Overview of Federated Learning for User-centered Privacy-preserving Computing","ACM Trans. Interact. Intell. Syst.","2021","11","3–4","","Association for Computing Machinery","New York, NY, USA","2021-10","2160-6455","https://doi.org/10.1145/3485875;http://dx.doi.org/10.1145/3485875","10.1145/3485875","With the rapid advances of Artificial Intelligence (AI) technologies and applications, an increasing concern is on the development and application of responsible AI technologies. Building AI technologies or machine-learning models often requires massive amounts of data, which may include sensitive, user private information to be collected from different sites or countries. Privacy, security, and data governance constraints rule out a brute force process in the acquisition and integration of these data. It is thus a serious challenge to protect user privacy while achieving high-performance models. This article reviews recent progress of federated learning in addressing this challenge in the context of privacy-preserving computing. Federated learning allows global AI models to be trained and used among multiple decentralized data sources with high security and privacy guarantees, as well as sound incentive mechanisms. This article presents the background, motivations, definitions, architectures, and applications of federated learning as a new paradigm for building privacy-preserving, responsible AI ecosystems.","blockchain, machine learning, data security, user privacy, privacy-preserving computing, decentralized AI, responsible AI, Federated learning",""
"Journal Article","Cooper BF,Narayan PP,Ramakrishnan R,Srivastava U,Silberstein A,Bohannon P,Jacobsen HA,Puz N,Weaver D,Yerneni R","PNUTS to Sherpa: lessons from Yahoo!'s cloud database","Proc. VLDB Endow.","2019","12","12","2300–2307","VLDB Endowment","","2019-08","2150-8097","https://doi.org/10.14778/3352063.3352146;http://dx.doi.org/10.14778/3352063.3352146","10.14778/3352063.3352146","In this paper, we look back at the evolution of Yahoo!'s geo-replicated cloud data store from a research project called PNUTS to a globally deployed production system called Sherpa, share some of the lessons learned along the way, and finally, compare PNUTS with current operational cloud stores.","",""
"Journal Article","Durner D,Chandramouli B,Li Y","Crystal: a unified cache storage system for analytical databases","Proc. VLDB Endow.","2021","14","11","2432–2444","VLDB Endowment","","2021-07","2150-8097","https://doi.org/10.14778/3476249.3476292;http://dx.doi.org/10.14778/3476249.3476292","10.14778/3476249.3476292","Cloud analytical databases employ a disaggregated storage model, where the elastic compute layer accesses data persisted on remote cloud storage in block-oriented columnar formats. Given the high latency and low bandwidth to remote storage and the limited size of fast local storage, caching data at the compute node is important and has resulted in a renewed interest in caching for analytics. Today, each DBMS builds its own caching solution, usually based on file-or block-level LRU. In this paper, we advocate a new architecture of a smart cache storage system called Crystal, that is co-located with compute. Crystal's clients are DBMS-specific ""data sources"" with push-down predicates. Similar in spirit to a DBMS, Crystal incorporates query processing and optimization components focusing on efficient caching and serving of single-table hyper-rectangles called regions. Results show that Crystal, with a small DBMS-specific data source connector, can significantly improve query latencies on unmodified Spark and Greenplum while also saving on bandwidth from remote storage.","",""
"Journal Article","Guo G,Chen H,Yan,Cheng J,Chen JY,Chong Z","Scalable De Novo Genome Assembly Using a Pregel-Like Graph-Parallel System","IEEE/ACM Trans. Comput. Biol. Bioinformatics","2021","18","2","731–744","IEEE Computer Society Press","Washington, DC, USA","2021-04","1545-5963","https://doi.org/10.1109/TCBB.2019.2920912;http://dx.doi.org/10.1109/TCBB.2019.2920912","10.1109/TCBB.2019.2920912","De novo genome assembly is the process of stitching short DNA sequences to generate longer DNA sequences, without using any reference sequence for alignment. It enables high-throughput genome sequencing and thus accelerates the discovery of new genomes. In this paper, we present a toolkit, called PPA-assembler, for de novo genome assembly in a distributed setting. The operations in our toolkit provide strong performance guarantees, and can be assembled to implement various sequencing strategies. PPA-assembler adopts the popular de Bruijn graph based approach for sequencing, and each operation is implemented as a program in Google’s Pregel framework which can be easily deployed in a generic cluster. Experiments on large real and simulated datasets demonstrate that PPA-assembler is much more efficient than the state-of-the-arts while providing comparable sequencing quality. PPA-assembler has been open-sourced at https://github.com/yaobaiwei/PPA-Assembler.","",""
"Journal Article","McClure Haughey M,Muralikumar MD,Wood CA,Starbird K","On the Misinformation Beat: Understanding the Work of Investigative Journalists Reporting on Problematic Information Online","Proc.  ACM Hum. -Comput.  Interact.","2020","4","CSCW2","","Association for Computing Machinery","New York, NY, USA","2020-10","","https://doi.org/10.1145/3415204;http://dx.doi.org/10.1145/3415204","10.1145/3415204","Journalists are increasingly investigating and reporting on problematic online content such as misinformation, disinformation, and conspiracy theories, leading to the creation of a new misinformation beat. The process of collecting, analyzing, and reporting on this kind of data is complex and nuanced. It is especially challenging as online actors attempt to undermine their work. Through in-depth interviews with twelve journalists, we explore how they investigate and report on online misinformation and disinformation. Our findings reveal some of the unique challenges of reporting on this beat, as well as the ways in which reporters overcome those challenges. We highlight and discuss how journalistic values could be better embedded into the design of tools to support their work, the power dynamics between social media companies and journalists, and the promise of collaborations as a way to support and educate journalists on this beat. This work provides contextual knowledge to researchers looking to better support investigative journalists - on the misinformation beat and beyond - as their work becomes more entangled in sociotechnical systems.","social media, misinformation, media manipulation, journalism, disinformation",""
"Journal Article","Sanches P,Brown B","Data Bites Man: The Production of Malaria by Technology","Proc.  ACM Hum. -Comput.  Interact.","2018","2","CSCW","","Association for Computing Machinery","New York, NY, USA","2018-11","","https://doi.org/10.1145/3274422;http://dx.doi.org/10.1145/3274422","10.1145/3274422","Malaria surveillance is a practice concerned with collection and analysis of data. This paper presents an ethnographical account of an international team of researchers producing data about malaria in the Zanzibar archipelago. We show that malaria is increasingly constituted by data, and inextricably interwoven with the practices of data workers using ICT tools. Through the practices we document here malaria: 1) becomes a problem to be managed by asymptomatic, as well as symptomatic individuals, 2) increases its geographical incidence through surveillance data and articulation work, and 3) becomes more certain, through coordination mechanisms enabled by ICT. As electronic data, malaria builds and mobilizes diverse human, organizational, and infrastructural worlds around it, who must now be dedicated to its production, management, and care.","surveillance, practices, malaria, data, coordination work",""
"Journal Article","Pibiri GE,Venturini R","Clustered Elias-Fano Indexes","ACM Trans. Inf. Syst.","2017","36","1","","Association for Computing Machinery","New York, NY, USA","2017-04","1046-8188","https://doi.org/10.1145/3052773;http://dx.doi.org/10.1145/3052773","10.1145/3052773","State-of-the-art encoders for inverted indexes compress each posting list individually. Encoding clusters of posting lists offers the possibility of reducing the redundancy of the lists while maintaining a noticeable query processing speed.In this article, we propose a new index representation based on clustering the collection of posting lists and, for each created cluster, building an ad hoc reference list with respect to which all lists in the cluster are encoded with Elias-Fano. We describe a posting lists clustering algorithm tailored for our encoder and two methods for building the reference list for a cluster. Both approaches are heuristic and differ in the way postings are added to the reference list: according to their frequency in the cluster or according to the number of bits necessary for their representation.The extensive experimental analysis indicates that significant space reductions are indeed possible, beating the best state-of-the-art encoders.","performance, inverted indexes, Elias-Fano encoding",""
"Journal Article","Cresci S,Lillo F,Regoli D,Tardelli S,Tesconi M","Cashtag Piggybacking: Uncovering Spam and Bot Activity in Stock Microblogs on Twitter","ACM Trans. Web","2019","13","2","","Association for Computing Machinery","New York, NY, USA","2019-04","1559-1131","https://doi.org/10.1145/3313184;http://dx.doi.org/10.1145/3313184","10.1145/3313184","Microblogs are increasingly exploited for predicting prices and traded volumes of stocks in financial markets. However, it has been demonstrated that much of the content shared in microblogging platforms is created and publicized by bots and spammers. Yet, the presence (or lack thereof) and the impact of fake stock microblogs has never been systematically investigated before. Here, we study 9M tweets related to stocks of the five main financial markets in the US. By comparing tweets with financial data from Google Finance, we highlight important characteristics of Twitter stock microblogs. More importantly, we uncover a malicious practice—referred to as cashtag piggybacking—perpetrated by coordinated groups of bots and likely aimed at promoting low-value stocks by exploiting the popularity of high-value ones. Among the findings of our study is that as much as 71% of the authors of suspicious financial tweets are classified as bots by a state-of-the-art spambot-detection algorithm. Furthermore, 37% of them were suspended by Twitter a few months after our investigation. Our results call for the adoption of spam- and bot-detection techniques in all studies and applications that exploit user-generated content for predicting the stock market.","stock market, spam and bot detection, social networks security, Twitter, Social spam",""
