"Item type","Authors","Title","Journal","Publication year","Volume","Issue","Pages","Publisher","Address","Date published","ISSN","URLs","DOI","Abstract","Keywords","Notes"
"Journal Article","Bagherzadeh M,Fireman N,Shawesh A,Khatchadourian R","Actor concurrency bugs: a comprehensive study on symptoms, root causes, API usages, and differences","Proc. ACM Program. Lang.","2020","4","OOPSLA","","Association for Computing Machinery","New York, NY, USA","2020-11","","https://doi.org/10.1145/3428282;http://dx.doi.org/10.1145/3428282","10.1145/3428282","Actor concurrency is becoming increasingly important in the development of real-world software systems. Although actor concurrency may be less susceptible to some multithreaded concurrency bugs, such as low-level data races and deadlocks, it comes with its own bugs that may be different. However, the fundamental characteristics of actor concurrency bugs, including their symptoms, root causes, API usages, examples, and differences when they come from different sources are still largely unknown. Actor software development can significantly benefit from a comprehensive qualitative and quantitative understanding of these characteristics, which is the focus of this work, to foster better API documentation, development practices, testing, debugging, repairing, and verification frameworks. To conduct this study, we take the following major steps. First, we construct a set of 186 real-world Akka actor bugs from Stack Overflow and GitHub via manual analysis of 3,924 Stack Overflow questions, answers, and comments and 3,315 GitHub commits, messages, original and modified code snippets, issues, and pull requests. Second, we manually study these actor bugs and their fixes to understand and classify their symptoms, root causes, and API usages. Third, we study the differences between the commonalities and distributions of symptoms, root causes, and API usages of our Stack Overflow and GitHub actor bugs. Fourth, we discuss real-world examples of our actor bugs with these symptoms and root causes. Finally, we investigate the relation of our findings with those of previous work and discuss their implications. A few findings of our study are: (1) symptoms of our actor bugs can be classified into five categories, with Error as the most common symptom and Incorrect Exceptions as the least common, (2) root causes of our actor bugs can be classified into ten categories, with Logic as the most common root cause and Untyped Communication as the least common, (3) a small number of Akka API packages are responsible for most of API usages by our actor bugs, and (4) our Stack Overflow and GitHub actor bugs can differ significantly in commonalities and distributions of their symptoms, root causes, and API usages. While some of our findings agree with those of previous work, others sharply contrast.","Stack Overflow, GitHub, Akka actor bugs, Actor bug symptoms, Actor bug root causes, Actor bug differences, Actor bug API usages",""
"Journal Article","Park S,Matic A,Garg K,Oliver N","When Simpler Data Does Not Imply Less Information: A Study of User Profiling Scenarios With Constrained View of Mobile HTTP(S) Traffic","ACM Trans. Web","2018","12","2","","Association for Computing Machinery","New York, NY, USA","2018-01","1559-1131","https://doi.org/10.1145/3143402;http://dx.doi.org/10.1145/3143402","10.1145/3143402","The exponential growth in smartphone adoption is contributing to the availability of vast amounts of human behavioral data. This data enables the development of increasingly accurate data-driven user models that facilitate the delivery of personalized services that are often free in exchange for the use of its customers’ data. Although such usage conventions have raised many privacy concerns, the increasing value of personal data is motivating diverse entities to aggressively collect and exploit the data. In this article, we unfold profiling scenarios around mobile HTTP(S) traffic, focusing on those that have limited but meaningful segments of the data. The capability of the scenarios to profile personal information is examined with real user data, collected in the wild from 61 mobile phone users for a minimum of 30 days. Our study attempts to model heterogeneous user traits and interests, including personality, boredom proneness, demographics, and shopping interests. Based on our modeling results, we discuss various implications to personalization, privacy, and personal data rights.","user modeling, personalized services, Mobile computing",""
"Journal Article","Joe-Wong C,Sen S,Ha S","Sponsoring Mobile Data: Analyzing the Impact on Internet Stakeholders","IEEE/ACM Trans. Netw.","2018","26","3","1179–1192","IEEE Press","","2018-06","1063-6692","https://doi.org/10.1109/TNET.2018.2826531;http://dx.doi.org/10.1109/TNET.2018.2826531","10.1109/TNET.2018.2826531","As demand for mobile data increases, end users increasingly need to pay more for consuming data. Sponsored data is a new pricing model that allows content providers CPs to subsidize some of this cost. It potentially offers benefits to multiple Internet stakeholders: users can enjoy lower data costs, CPs can attract more users by subsidizing their data access, and Internet service providers ISPs can create new revenue streams by charging CPs for sponsored data. However, the distribution of these benefits between different users, CPs, and the ISP remains unclear. Although concerns have been raised that sponsored data disproportionately benefits larger, less cost-sensitive CPs, little attention has been paid to analyzing sponsored data’s impact on end users. This paper does so by first formulating an analytical model of user, CP, and ISP interactions for heterogeneous users and CPs and deriving their optimal behaviors. We then show that while all three parties can benefit from sponsored data, sponsorship benefits users more than CPs. These disproportionate benefits are more pronounced for more cost-sensitive users when they receive sponsorship from less cost-sensitive CPs, indicating that sponsored data may help to bridge the digital divide between users who can afford the cost of mobile data and those who cannot. We then show that sponsorship disproportionately benefits less cost-sensitive CPs and more cost-sensitive users, exacerbating disparities among CPs but reducing disparities among users. We finally illustrate these results through numerical simulations with data from a commercial pricing trial.","",""
"Journal Article","Xu H,Yu Z,Li XY,Huang L,Qian C,Jung T,Xu H,Yu Z,Li XY,Huang L,Qian C,Jung T","Joint Route Selection and Update Scheduling for Low-Latency Update in SDNs","IEEE/ACM Trans. Netw.","2017","25","5","3073–3087","IEEE Press","","2017-10","1063-6692","https://doi.org/10.1109/TNET.2017.2717441;http://dx.doi.org/10.1109/TNET.2017.2717441","10.1109/TNET.2017.2717441","Due to flow dynamics, a software defined network SDN may need to frequently update its data plane so as to optimize various performance objectives, such as load balancing. Most previous solutions first determine a new route configuration based on the current flow status, and then update the forwarding paths of existing flows. However, due to slow update operations of Ternary Content Addressable Memory-based flow tables, unacceptable update delays may occur, especially in a large or frequently changed network. According to recent studies, most flows have short duration and the workload of the entire network will vary significantly after a long duration. As a result, the new route configuration may be no longer efficient for the workload after the update, if the update duration takes too long. In this paper, we address the real-time route update, which jointly considers the optimization of flow route selection in the control plane and update scheduling in the data plane. We formulate the delay-satisfied route update problem, and prove its NP-hardness. Two algorithms with bounded approximation factors are designed to solve this problem. We implement the proposed methods on our SDN test bed. The experimental results and extensive simulation results show that our method can reduce the route update delay by about 60% compared with previous route update methods while preserving a similar routing performance with link load ratio increased less than 3%.","",""
"Journal Article","Rossetti G,Cazabet R","Community Discovery in Dynamic Networks: A Survey","ACM Comput. Surv.","2018","51","2","","Association for Computing Machinery","New York, NY, USA","2018-02","0360-0300","https://doi.org/10.1145/3172867;http://dx.doi.org/10.1145/3172867","10.1145/3172867","Several research studies have shown that complex networks modeling real-world phenomena are characterized by striking properties: (i) they are organized according to community structure, and (ii) their structure evolves with time. Many researchers have worked on methods that can efficiently unveil substructures in complex networks, giving birth to the field of community discovery. A novel and fascinating problem started capturing researcher interest recently: the identification of evolving communities. Dynamic networks can be used to model the evolution of a system: nodes and edges are mutable, and their presence, or absence, deeply impacts the community structure that composes them.This survey aims to present the distinctive features and challenges of dynamic community discovery and propose a classification of published approaches. As a “user manual,” this work organizes state-of-the-art methodologies into a taxonomy, based on their rationale, and their specific instantiation. Given a definition of network dynamics, desired community characteristics, and analytical needs, this survey will support researchers to identify the set of approaches that best fit their needs. The proposed classification could also help researchers choose in which direction to orient their future research.","temporal networks, community discovery, Dynamic networks",""
